{"candidate_ref":"sha256:15affdfb677cc6a94a4a5364da68ca2d11441f899737651e727dbac90eddc5ab","disposition":"parsed","policy_hash":"sha256:ee9efa7b00dc22042d7b48aeba86f80170128d3c476761d324816164937d5f92","qualification_identity_ref":"sha256:6f365a44b975465943da88d0e3fe4f123672e00913285a3e998ab465bc79edca","repetition":2,"report":{"bytes":852,"locator":"repetition-2/reports/ab-aozora/000001_1-da60a6da1ef5.json","media_type":"application/json","sha256":"sha256:dc17015014e07262b6ee87a4a38e53134d6e3d9593eecf91c0be10d99380edcc"},"schema_id":"https://w3id.org/abc/schemas/parser-rq-core-attempt-work.schema.json","schema_version":"1.0.0","source_sha256":"sha256:5b301747e172bc6450ea7de1a50f534c3ed1ead43dccd2008e32219f43e46f71","status":"measured","work_id":"000001_1"}
