{"candidate_ref":"sha256:24d61fc75b0dd2405a423ebc0a06bd3002e37b7d8b9ed4a76b2c21d57eb2b3ec","disposition":"parsed","policy_hash":"sha256:ee9efa7b00dc22042d7b48aeba86f80170128d3c476761d324816164937d5f92","qualification_identity_ref":"sha256:8c1716f07a76ecf79109fe922a84878765c8dbae795b94bdff66e354d960d366","repetition":3,"report":{"bytes":852,"locator":"repetition-3/reports/ab-aozora/000002_2-af75700b091c.json","media_type":"application/json","sha256":"sha256:2926864218693a7edd1db875626161cc51ba8d245adb0a8b6590bbbdc67fe3b5"},"schema_id":"https://w3id.org/abc/schemas/parser-rq-core-attempt-work.schema.json","schema_version":"1.0.0","source_sha256":"sha256:f52fa5a06842f566238c15c2327f5f2e4ffe43a6e7ae4d6fd7bab8ad4449549c","status":"measured","work_id":"000002_2"}
